<!ELEMENT programmingLanguages (language+)>
<!ELEMENT language (description, example)>
<!ATTLIST language name CDATA #REQUIRED>
<!ELEMENT description (#PCDATA)>
<!ELEMENT example (#PCDATA)>
<!ATTLIST programmingLanguages xmlns:xsi CDATA #IMPLIED>
<!ATTLIST xsi:noNamespaceSchemaLocation  xmlns:xsi CDATA #IMPLIED>